<!--
This file is protected by Copyright. Please refer to the COPYRIGHT file 
distributed with this source distribution.

This file is part of REDHAWK core.

REDHAWK core is free software: you can redistribute it and/or modify it under 
the terms of the GNU Lesser General Public License as published by the Free 
Software Foundation, either version 3 of the License, or (at your option) any 
later version.

REDHAWK core is distributed in the hope that it will be useful, but WITHOUT ANY 
WARRANTY; without even the implied warranty of MERCHANTABILITY or FITNESS FOR 
A PARTICULAR PURPOSE.  See the GNU Lesser General Public License for more 
details.

You should have received a copy of the GNU Lesser General Public License along 
with this program.  If not, see http://www.gnu.org/licenses/.
-->

<!ELEMENT deviceconfiguration
	( description?
	, devicemanagersoftpkg
	, componentfiles?
	, partitioning?
	, connections?
	, domainmanager
	, filesystemnames?
	)>
<!ATTLIST deviceconfiguration
	id		ID	#REQUIRED
	name		CDATA	#IMPLIED>

<!ELEMENT description (#PCDATA)>

<!ELEMENT devicemanagersoftpkg
	( localfile
	)>

<!ELEMENT componentfiles 
	( componentfile+
	)>

<!ELEMENT componentfile
	( localfile 
	)>
<!ATTLIST componentfile
	id 		ID	#REQUIRED
	type		CDATA	#IMPLIED>

<!ELEMENT localfile EMPTY>
<!ATTLIST localfile
	name		CDATA	#REQUIRED>

<!ELEMENT partitioning 
	( componentplacement
	)*>

<!ELEMENT componentplacement 
	( componentfileref
	, deployondevice?
	, compositepartofdevice?
	, devicepkgfile?
	, componentinstantiation+
	)>

<!ELEMENT componentfileref  EMPTY>
<!ATTLIST componentfileref
	refid		CDATA	#REQUIRED>

<!ELEMENT deployondevice  EMPTY>
<!ATTLIST deployondevice
	refid		CDATA	#REQUIRED>

<!ELEMENT compositepartofdevice  EMPTY>
<!ATTLIST compositepartofdevice
	refid		CDATA	#REQUIRED>

<!ELEMENT devicepkgfile 
	(localfile
	)>
<!ATTLIST devicepkgfile
	type		CDATA	#IMPLIED>

<!ELEMENT componentinstantiation
	( usagename?
	 ,componentproperties?
         ,affinity?
         ,loggingconfig?
         ,deployerrequires?
	)>
<!ATTLIST componentinstantiation
    id  ID  #REQUIRED
    startorder CDATA #IMPLIED>

<!ELEMENT usagename (#PCDATA)>

<!ELEMENT loggingconfig (#PCDATA)>
<!ATTLIST loggingconfig 
          level CDATA #IMPLIED>

<!ELEMENT affinity
	( simpleref
	| simplesequenceref
	| structref
	| structsequenceref
	)+ >

<!ELEMENT deployerrequires
	( requires
	)+ >

<!ELEMENT componentproperties 
	( simpleref
	| simplesequenceref
	| structref
	| structsequenceref
	)+ >

<!ELEMENT devicethatloadedthiscomponentref EMPTY>
<!ATTLIST devicethatloadedthiscomponentref 
	refid		CDATA	#REQUIRED>

<!ELEMENT deviceusedbythiscomponentref EMPTY>
<!ATTLIST deviceusedbythiscomponentref 
	refid		CDATA	#REQUIRED
	usesrefid	CDATA	#REQUIRED>

<!ELEMENT requires EMPTY>
<!ATTLIST requires
	id		CDATA	#REQUIRED
	value		CDATA	#REQUIRED>

<!ELEMENT simpleref EMPTY>
<!ATTLIST simpleref
	refid		CDATA	#REQUIRED
	value		CDATA	#REQUIRED>
		
<!ELEMENT simplesequenceref
	(values
	)>
<!ATTLIST simplesequenceref
	refid		CDATA	#REQUIRED>

<!ELEMENT structref
	( (simpleref | simplesequenceref)+
	)>
<!ATTLIST structref
	refid		CDATA	#REQUIRED>

<!ELEMENT structsequenceref
	( structvalue+
	)>
<!ATTLIST structsequenceref
	refid		CDATA	#REQUIRED>

<!ELEMENT structvalue
	( (simpleref | simplesequenceref)+
	)>
		
<!ELEMENT values
	( value+ 
	)>
		
<!ELEMENT value (#PCDATA)>

<!ELEMENT componentinstantiationref EMPTY>
<!ATTLIST componentinstantiationref 
	refid	CDATA	#REQUIRED>

<!ELEMENT domainmanager
	( namingservice
	| stringifiedobjectref
	)>

<!ELEMENT findby
	( namingservice
	| stringifiedobjectref
	| domainfinder
	)>

<!ELEMENT namingservice EMPTY>
<!ATTLIST namingservice
	name		CDATA	#REQUIRED>

<!ELEMENT stringifiedobjectref (#PCDATA)>

<!ELEMENT domainfinder EMPTY>
<!ATTLIST domainfinder
	type		CDATA	#REQUIRED
	name		CDATA	#IMPLIED>

<!ELEMENT filesystemnames
	(filesystemname+
	)>

<!ELEMENT filesystemname EMPTY>
<!ATTLIST filesystemname
	mountname	CDATA	#REQUIRED
	deviceid	CDATA	#REQUIRED>

<!ELEMENT connections
      ( connectinterface*
      )>

<!ELEMENT connectinterface
	( usesport
	, ( providesport
	  | componentsupportedinterface
	  | findby
	  )
	)>

<!ATTLIST connectinterface
	id		ID	#IMPLIED>

<!ELEMENT usesport
	( usesidentifier
	, (componentinstantiationref
	   | devicethatloadedthiscomponentref
	   | deviceusedbythiscomponentref
	   | findby
	   )
	)>

<!ELEMENT usesidentifier (#PCDATA)>

<!ELEMENT providesport
	( providesidentifier
	, ( componentinstantiationref
	  | devicethatloadedthiscomponentref
	  | deviceusedbythiscomponentref
	  | findby
	  )
	)>

<!ELEMENT providesidentifier (#PCDATA)>

<!ELEMENT componentsupportedinterface
	( supportedidentifier
	, ( componentinstantiationref
	  | findby
	  )
	)>

<!ELEMENT supportedidentifier (#PCDATA)>
