<?xml version="1.0" encoding="UTF-8"?>
<!--
This file is protected by Copyright. Please refer to the COPYRIGHT file 
distributed with this source distribution.

This file is part of REDHAWK core.

REDHAWK core is free software: you can redistribute it and/or modify it under 
the terms of the GNU Lesser General Public License as published by the Free 
Software Foundation, either version 3 of the License, or (at your option) any 
later version.

REDHAWK core is distributed in the hope that it will be useful, but WITHOUT ANY 
WARRANTY; without even the implied warranty of MERCHANTABILITY or FITNESS FOR 
A PARTICULAR PURPOSE.  See the GNU Lesser General Public License for more 
details.

You should have received a copy of the GNU Lesser General Public License along 
with this program.  If not, see http://www.gnu.org/licenses/.
-->

<!DOCTYPE deviceconfiguration PUBLIC "-//JTRS//DTD SCA V2.2.2 DCD//EN" "deviceconfiguration.dtd">
<!-- Created with REDHAWK IDE-->
<!-- Powered by Eclipse -->
<deviceconfiguration name="SimpleDevMgr" id="DCE:cbdaf8db-097a-49cc-9fa3-e4c34b077485">
    <devicemanagersoftpkg>
    	<localfile name="/mgr/DeviceManager.spd.xml">
    	</localfile>
    </devicemanagersoftpkg>
    <componentfiles>
    	<componentfile type="SPD" id="SimpleDevice_938e5cd6-0d37-46ef-a2a8-348f17dbcbe3">
    		<localfile name="/devices/SimpleDevice/SimpleDevice.spd.xml">
    		</localfile>
    	</componentfile>
    </componentfiles>
    <partitioning>
		<componentplacement>
	    	<componentfileref refid="SimpleDevice_938e5cd6-0d37-46ef-a2a8-348f17dbcbe3">
    		</componentfileref>
	     	<componentinstantiation id="DCE:a3c74ad2-61ea-4ade-8b55-61c36a54f17d">
	     		<usagename>SimpleDevice_1</usagename>
	     	</componentinstantiation>
    	</componentplacement>
    </partitioning>
    <domainmanager>
    	<namingservice name="REDHAWK_DEV/REDHAWK_DEV">
    	</namingservice>
    </domainmanager>
</deviceconfiguration>
