<?xml version="1.0" encoding="UTF-8"?>
<!--
This file is protected by Copyright. Please refer to the COPYRIGHT file 
distributed with this source distribution.

This file is part of REDHAWK core.

REDHAWK core is free software: you can redistribute it and/or modify it under 
the terms of the GNU Lesser General Public License as published by the Free 
Software Foundation, either version 3 of the License, or (at your option) any 
later version.

REDHAWK core is distributed in the hope that it will be useful, but WITHOUT ANY 
WARRANTY; without even the implied warranty of MERCHANTABILITY or FITNESS FOR 
A PARTICULAR PURPOSE.  See the GNU Lesser General Public License for more 
details.

You should have received a copy of the GNU Lesser General Public License along 
with this program.  If not, see http://www.gnu.org/licenses/.
-->

<!DOCTYPE deviceconfiguration PUBLIC '-//JTRS//DTD SCA V2.2.2 DCD//EN' 'deviceconfiguration.dtd'>
<deviceconfiguration name="BasicTestDevice_node" id="DCE:65f84ea9-cbe9-42cc-bc2e-6807f7ff9b8c">
    <devicemanagersoftpkg>
        <localfile name="/mgr/DeviceManager.spd.xml"/>
    </devicemanagersoftpkg>
    <componentfiles>
        <!--Device Definitions--> 
        <componentfile type="SPD" id="BasicTestDevice1_c6e250b8-5223-11db-9fc4-000d56d8556e">
            <localfile name="/devices/BasicTestDevice/BasicTestDevice.spd.xml"/>
        </componentfile>
    </componentfiles>
    <partitioning>
        <componentplacement>
            <componentfileref refid="BasicTestDevice1_c6e250b8-5223-11db-9fc4-000d56d8556e"/>
            <componentinstantiation id="DCE:8f3478e3-626e-45c3-bd01-0a8117dbe59b">
                <!--componentinstantiation id="DCE:cdffec5c-5223-11db-9502-000d56d8556e"-->
                <usagename>BasicTestDevice1</usagename> 
            </componentinstantiation>
        </componentplacement>
        <componentplacement>
            <componentfileref refid="BasicTestDevice1_c6e250b8-5223-11db-9fc4-000d56d8556e"/>
            <componentinstantiation id="DCE:fd5c549f-d97c-4665-bce7-d26f4d9680f8">
                <!--componentinstantiation id="DCE:cdffec5c-5223-11db-9502-000d56d8556e"-->
                <usagename>BasicTestDevice1</usagename> 
            </componentinstantiation>
        </componentplacement>
    </partitioning>
    <domainmanager>
        <namingservice name="DomainName1/DomainManager"/>
    </domainmanager>
</deviceconfiguration>
