<?xml version="1.0" encoding="UTF-8"?>
<!--
This file is protected by Copyright. Please refer to the COPYRIGHT file 
distributed with this source distribution.

This file is part of REDHAWK core.

REDHAWK core is free software: you can redistribute it and/or modify it under 
the terms of the GNU Lesser General Public License as published by the Free 
Software Foundation, either version 3 of the License, or (at your option) any 
later version.

REDHAWK core is distributed in the hope that it will be useful, but WITHOUT ANY 
WARRANTY; without even the implied warranty of MERCHANTABILITY or FITNESS FOR 
A PARTICULAR PURPOSE.  See the GNU Lesser General Public License for more 
details.

You should have received a copy of the GNU Lesser General Public License along 
with this program.  If not, see http://www.gnu.org/licenses/.
-->

<!DOCTYPE deviceconfiguration PUBLIC '-//JTRS//DTD SCA V2.2.2 DCD//EN' 'deviceconfiguration.dtd'>
<!-- Created with REDHAWK IDE-->
<!-- Powered by Eclipse -->
<deviceconfiguration name="PortTestDevice_node" id="DCE:33708d3b-beed-40a3-b490-334cdd6af80a">
    <devicemanagersoftpkg>
    	<localfile name="/mgr/DeviceManager.spd.xml" />
    </devicemanagersoftpkg>
    <componentfiles>
        <componentfile type="SPD" id="PortTestDevice1_c6e250b8-5223-11db-9fc4-000d56d8556e">
            <localfile name="/devices/PortTestDevice/PortTestDevice.spd.xml"/>
        </componentfile>        
    </componentfiles>
    <partitioning>
        <componentplacement>
            <componentfileref refid="PortTestDevice1_c6e250b8-5223-11db-9fc4-000d56d8556e"/>
            <componentinstantiation id="DCE:322fb9b2-de57-42a2-ad03-217bcb244262">
                <usagename>PortTestDevice1</usagename> 
            </componentinstantiation>
        </componentplacement>
        <componentplacement>
            <componentfileref refid="PortTestDevice1_c6e250b8-5223-11db-9fc4-000d56d8556e"/>
            <componentinstantiation id="DCE:47dc45d8-19b5-4b7e-bcd4-b165babe5b84">
                <usagename>PortTestDevice2</usagename> 
            </componentinstantiation>
        </componentplacement>
    </partitioning>
    <connections>
        <connectinterface>
            <usesport>
                <usesidentifier>resource_out</usesidentifier>
                <componentinstantiationref refid="DCE:322fb9b2-de57-42a2-ad03-217bcb244262"/>
            </usesport>
            <providesport>
                <providesidentifier>resource_in</providesidentifier>
                <componentinstantiationref refid="DCE:47dc45d8-19b5-4b7e-bcd4-b165babe5b84"/>
            </providesport>
        </connectinterface>
    </connections>
    <domainmanager>
        <namingservice name="DomainName1/DomainManager"/>
    </domainmanager>
</deviceconfiguration>
